{
  "counts": {
    "errored": 1,
    "expected": 4,
    "missing": 1,
    "score_present": 1,
    "scored": 1,
    "unscored": 1
  },
  "errored_with_score_ids": [],
  "exit_code": 1,
  "inputs": {
    "manifest_sha256": "19bbc1187511d78fda3b6c028ee34c2d056c14004b4f8da67f7a3436dd9c4de3",
    "records_sha256": "90114e394ad6d128c0e6daeb0fef62928f4a4a3c1539c7239d2fea1a9d6c7555"
  },
  "missing_ids": [
    "case-4"
  ],
  "run_id": "synthetic-coverage-01",
  "schema_version": 1,
  "score_present_coverage": 0.25,
  "unexpected_ids": []
}
